{
  "schema_version": "1.0",
  "batch_id": "01a15df9-a808-71a8-ac0f-237ec49e19c3",
  "server_received_at": "2026-10-21T05:05:01.000Z",
  "clock_offset_estimate_ms": -830.0,
  "duplicate_batch": false,
  "results": [
    {
      "event_id": "01a15df9-9480-7f6f-a9d5-b1f8b6267644",
      "session_id": "01a15df9-9480-78bd-98a1-a021f6e0e2f9",
      "seq": 0,
      "status": "duplicate",
      "reason_code": null
    },
    {
      "event_id": "01a15df9-9485-741b-b2b2-bc73848704bd",
      "session_id": "01a15df9-9480-78bd-98a1-a021f6e0e2f9",
      "seq": 1,
      "status": "accepted",
      "reason_code": null
    },
    {
      "event_id": "01a15df9-b7a8-7011-b873-25e6caa7c7fb",
      "session_id": "01a15df9-9480-78bd-98a1-a021f6e0e2f9",
      "seq": 2,
      "status": "accepted",
      "reason_code": null
    },
    {
      "event_id": "01a15dfa-30c0-78d9-b06c-70dac735f33d",
      "session_id": "01a15df9-9480-78bd-98a1-a021f6e0e2f9",
      "seq": 3,
      "status": "accepted",
      "reason_code": null
    },
    {
      "event_id": "01a15dfb-de70-7a3e-b090-353525cac542",
      "session_id": "01a15df9-9480-78bd-98a1-a021f6e0e2f9",
      "seq": 4,
      "status": "accepted",
      "reason_code": null
    },
    {
      "event_id": "01a15dfc-6340-7ad8-a87b-d742b5ed22f1",
      "session_id": "01a15df9-9480-78bd-98a1-a021f6e0e2f9",
      "seq": 5,
      "status": "accepted",
      "reason_code": null
    },
    {
      "event_id": "01a15dfc-6418-7b6f-87fe-087b3422364a",
      "session_id": "01a15df9-9480-78bd-98a1-a021f6e0e2f9",
      "seq": 6,
      "status": "accepted",
      "reason_code": null
    },
    {
      "event_id": "01a15dfc-65b5-7466-a0b0-c1770b930941",
      "session_id": "01a15df9-9480-78bd-98a1-a021f6e0e2f9",
      "seq": 7,
      "status": "accepted",
      "reason_code": null
    },
    {
      "event_id": "01a15dfc-68c8-711f-8f0e-475fb086784d",
      "session_id": "01a15df9-9480-78bd-98a1-a021f6e0e2f9",
      "seq": 8,
      "status": "accepted",
      "reason_code": null
    },
    {
      "event_id": "01a15e06-6d90-7d2f-870e-59b09259344c",
      "session_id": "01a15df9-9480-78bd-98a1-a021f6e0e2f9",
      "seq": 9,
      "status": "accepted",
      "reason_code": null
    }
  ],
  "summary": {
    "accepted": 9,
    "duplicate": 1,
    "parked": 0,
    "rejected_terminal": 0,
    "retryable": 0
  }
}
